Chatham University,2598,St. Francis (PA),110412
time,team_id,description,h_score,a_score
19:46,-1,Foul on Logan Hunter.,0,0
19:41,2598,Josh Nebo made Layup. Assisted by Scott Meredith.,0,2
19:33,-1,Nasir Alexander made Three Point Jumper. Assisted by Anthony Bomar.,3,2
19:15,2598,Josh Nebo made Dunk. Assisted by Scott Meredith.,3,4
19:02,-1,Logan Hunter missed Jumper.,3,4
19:02,2598,St. Francis (PA) Defensive Rebound.,3,4
18:46,2598,Randall Gaskins Jr. missed Layup.,3,4
18:46,-1,Isaiah Brown Defensive Rebound.,3,4
18:41,-1,Isaiah Brown Turnover.,3,4
18:38,2598,Randall Gaskins Jr. Steal.,3,4
18:31,2598,Georgios Angelou made Three Point Jumper.,3,7
18:07,-1,Logan Hunter made Three Point Jumper.,6,7
17:52,2598,Josh Nebo made Dunk. Assisted by Scott Meredith.,6,9
17:40,-1,Alex Schoppen missed Three Point Jumper.,6,9
17:40,2598,Georgios Angelou Defensive Rebound.,6,9
17:27,2598,Josh Nebo made Layup. Assisted by Georgios Angelou.,6,11
17:24,-1,Chatham University  Timeout,6,11
17:08,-1,Isaiah Brown missed Three Point Jumper.,6,11
17:08,2598,Josh Nebo Block.,6,11
17:06,-1,Isaiah Brown Offensive Rebound.,6,11
17:03,-1,Anthony Bomar made Jumper. Assisted by Isaiah Brown.,8,11
16:51,2598,Georgios Angelou Turnover.,8,11
16:49,-1,Isaiah Brown Steal.,8,11
16:46,2598,Foul on Georgios Angelou.,8,11
16:46,-1,Anthony Bomar made Free Throw.,9,11
16:46,-1,Anthony Bomar missed Free Throw.,9,11
16:46,2598,Scott Meredith Defensive Rebound.,9,11
16:45,2598,Keith Braxton made Three Point Jumper. Assisted by Georgios Angelou.,9,14
16:26,-1,Logan Hunter missed Three Point Jumper.,9,14
16:26,2598,Keith Braxton Defensive Rebound.,9,14
16:17,2598,Scott Meredith missed Three Point Jumper.,9,14
16:17,2598,Josh Nebo Offensive Rebound.,9,14
16:11,2598,Josh Nebo made Jumper. Assisted by Keith Braxton.,9,16
15:46,2598,Foul on Georgios Angelou.,9,16
15:46,-1,Logan Hunter made Free Throw.,10,16
15:46,-1,Logan Hunter missed Free Throw.,10,16
15:46,2598,Keith Braxton Defensive Rebound.,10,16
15:39,2598,Deivydas Kuzavas made Layup.,10,18
15:31,-1,Logan Hunter missed Three Point Jumper.,10,18
15:31,2598,Isaiah Blackmon Defensive Rebound.,10,18
15:24,2598,Andre Wolford missed Three Point Jumper.,10,18
15:24,-1,Chatham University Deadball Team Rebound.,10,18
15:21,2598,Foul on Deivydas Kuzavas.,10,18
15:10,-1,Alex Schoppen made Jumper. Assisted by Josh Randall.,12,18
14:49,2598,Isaiah Blackmon missed Layup.,12,18
14:49,-1,Alex Schoppen Defensive Rebound.,12,18
14:42,-1,Reggie Rogers missed Layup.,12,18
14:42,2598,Keith Braxton Defensive Rebound.,12,18
14:35,2598,Andre Wolford made Layup.,12,20
14:35,-1,Foul on Josh Randall.,12,20
14:35,2598,Andre Wolford missed Free Throw.,12,20
14:35,2598,Isaiah Blackmon Offensive Rebound.,12,20
14:34,2598,Isaiah Blackmon made Layup.,12,22
14:28,-1,Reggie Rogers Turnover.,12,22
14:27,2598,Keith Braxton Steal.,12,22
14:25,2598,Isaiah Blackmon made Layup. Assisted by Keith Braxton.,12,24
13:53,-1,Josh Randall made Layup.,14,24
13:33,2598,Deivydas Kuzavas missed Layup.,14,24
13:33,-1,Devin Stedman Defensive Rebound.,14,24
13:10,-1,Isaiah Brown Turnover.,14,24
13:09,2598,Andre Wolford Steal.,14,24
13:07,-1,Foul on Reggie Rogers.,14,24
13:07,2598,Keith Braxton made Free Throw.,14,25
13:07,2598,Keith Braxton missed Free Throw.,14,25
13:07,-1,Devin Stedman Defensive Rebound.,14,25
12:59,-1,Reggie Rogers missed Jumper.,14,25
12:59,2598,Andre Wolford Block.,14,25
12:56,2598,Daniel Wallace Defensive Rebound.,14,25
12:54,2598,Isaiah Blackmon Turnover.,14,25
12:28,-1,Ian Schrenk missed Layup.,14,25
12:28,2598,Andre Wolford Block.,14,25
12:26,2598,Keith Braxton Defensive Rebound.,14,25
12:22,2598,Andre Wolford made Three Point Jumper. Assisted by Keith Braxton.,14,28
12:03,-1,Josh Randall missed Layup.,14,28
12:03,2598,Deivydas Kuzavas Block.,14,28
12:00,2598,Keith Braxton Defensive Rebound.,14,28
11:56,2598,Isaiah Blackmon missed Three Point Jumper.,14,28
11:56,2598,Daniel Wallace Offensive Rebound.,14,28
11:53,-1,Foul on Devin Stedman.,14,28
11:50,2598,Scott Meredith made Three Point Jumper. Assisted by Jamaal King.,14,31
11:42,2598,Foul on Jamaal King.,14,31
11:28,-1,Isaiah Brown missed Layup.,14,31
11:28,2598,Josh Nebo Defensive Rebound.,14,31
11:17,2598,Scott Meredith missed Three Point Jumper.,14,31
11:17,2598,Ifeanyi Umezurike Offensive Rebound.,14,31
11:12,2598,Josh Nebo missed Layup.,14,31
11:12,-1,Nasir Alexander Defensive Rebound.,14,31
11:02,-1,Devin Stedman Turnover.,14,31
10:42,2598,Ifeanyi Umezurike missed Layup.,14,31
10:42,-1,Nasir Alexander Defensive Rebound.,14,31
10:21,-1,Anthony Bomar made Three Point Jumper. Assisted by Ian Schrenk.,17,31
10:02,2598,Scott Meredith missed Three Point Jumper.,17,31
10:02,-1,Chatham University Defensive Rebound.,17,31
9:43,-1,Alex Schoppen made Three Point Jumper. Assisted by Anthony Bomar.,20,31
9:16,-1,Foul on Logan Hunter.,20,31
9:01,2598,Jamaal King Turnover.,20,31
8:59,-1,Nasir Alexander Steal.,20,31
8:54,-1,Anthony Bomar made Layup. Assisted by Nasir Alexander.,22,31
8:33,-1,Foul on Nasir Alexander.,22,31
8:30,2598,Scott Meredith made Three Point Jumper. Assisted by Jamaal King.,22,34
8:09,-1,Nasir Alexander missed Three Point Jumper.,22,34
8:09,2598,Jamaal King Defensive Rebound.,22,34
8:03,-1,Foul on Isaiah Brown.,22,34
8:03,2598,Jamaal King made Free Throw.,22,35
8:03,2598,Jamaal King made Free Throw.,22,36
7:57,-1,Josh Randall missed Three Point Jumper.,22,36
7:57,2598,Josh Nebo Defensive Rebound.,22,36
7:46,2598,Randall Gaskins Jr. missed Jumper.,22,36
7:46,-1,Reggie Rogers Defensive Rebound.,22,36
7:42,-1,Reggie Rogers Turnover.,22,36
7:41,2598,Jamaal King Steal.,22,36
7:39,2598,Jamaal King made Jumper.,22,38
7:25,-1,Reggie Rogers Turnover.,22,38
7:24,2598,Randall Gaskins Jr. Steal.,22,38
7:13,2598,Foul on Isaiah Blackmon.,22,38
7:08,-1,Alex Schoppen Turnover.,22,38
6:57,2598,Andre Wolford missed Three Point Jumper.,22,38
6:57,-1,Justin Baker Defensive Rebound.,22,38
6:47,-1,Justin Baker missed Three Point Jumper.,22,38
6:47,2598,Isaiah Blackmon Defensive Rebound.,22,38
6:28,2598,Isaiah Blackmon made Jumper. Assisted by Georgios Angelou.,22,40
5:59,-1,Isaiah Brown missed Three Point Jumper.,22,40
5:59,-1,Josh Randall Offensive Rebound.,22,40
5:55,-1,Chatham University  Turnover.,22,40
5:29,-1,Foul on Ian Schrenk.,22,40
5:29,2598,Georgios Angelou missed Free Throw.,22,40
5:29,-1,Justin Baker Defensive Rebound.,22,40
5:25,-1,Reggie Rogers missed Three Point Jumper.,22,40
5:25,2598,Keith Braxton Defensive Rebound.,22,40
5:15,2598,Keith Braxton made Three Point Jumper. Assisted by Georgios Angelou.,22,43
4:52,-1,Justin Baker missed Three Point Jumper.,22,43
4:52,2598,Isaiah Blackmon Defensive Rebound.,22,43
4:44,2598,Isaiah Blackmon made Layup.,22,45
4:33,-1,Ian Schrenk made Layup.,24,45
4:25,-1,Foul on Josh Randall.,24,45
4:25,2598,Georgios Angelou made Free Throw.,24,46
4:25,2598,Georgios Angelou made Free Throw.,24,47
4:10,-1,Buzz Walker missed Three Point Jumper.,24,47
4:10,2598,Isaiah Blackmon Defensive Rebound.,24,47
4:02,2598,Keith Braxton made Layup. Assisted by Isaiah Blackmon.,24,49
3:37,-1,Anthony Bomar missed Jumper.,24,49
3:37,-1,Devin Stedman Offensive Rebound.,24,49
3:28,2598,Foul on Ifeanyi Umezurike.,24,49
3:14,-1,Anthony Bomar missed Three Point Jumper.,24,49
3:14,2598,Deivydas Kuzavas Defensive Rebound.,24,49
2:56,-1,Foul on Devin Stedman.,24,49
2:56,2598,Deivydas Kuzavas made Free Throw.,24,50
2:56,2598,Deivydas Kuzavas missed Free Throw.,24,50
2:56,-1,Chatham University Deadball Team Rebound.,24,50
2:56,2598,Foul on Ifeanyi Umezurike.,24,50
2:56,-1,Ian Schrenk made Free Throw.,25,50
2:56,-1,Ian Schrenk missed Free Throw.,25,50
2:56,2598,Deivydas Kuzavas Defensive Rebound.,25,50
2:43,2598,Deivydas Kuzavas missed Layup.,25,50
2:43,2598,Deivydas Kuzavas Offensive Rebound.,25,50
2:40,2598,Deivydas Kuzavas missed Layup.,25,50
2:40,-1,Jack Ridenour Defensive Rebound.,25,50
2:30,-1,Anthony Bomar made Layup.,27,50
2:18,2598,Deivydas Kuzavas made Dunk. Assisted by Randall Gaskins Jr..,27,52
2:08,2598,Foul on Deivydas Kuzavas.,27,52
2:08,-1,Ian Schrenk missed Free Throw.,27,52
2:08,-1,Chatham University Deadball Team Rebound.,27,52
2:08,-1,Ian Schrenk made Free Throw.,28,52
1:49,2598,Jamaal King missed Layup.,28,52
1:49,2598,Deivydas Kuzavas Offensive Rebound.,28,52
1:27,2598,Foul on Ifeanyi Umezurike.,28,52
1:27,2598,Ifeanyi Umezurike Turnover.,28,52
1:07,-1,Alex Schoppen made Three Point Jumper. Assisted by Jack Ridenour.,31,52
0:51,2598,Jamaal King missed Three Point Jumper.,31,52
0:51,-1,Jack Ridenour Defensive Rebound.,31,52
0:31,-1,Alex Schoppen made Jumper.,33,52
0:29,2598,St. Francis (PA)  Timeout,33,52
0:23,-1,Foul on Justin Baker.,33,52
0:23,2598,Deivydas Kuzavas missed Free Throw.,33,52
0:23,2598,St. Francis (PA) Deadball Team Rebound.,33,52
0:23,2598,Deivydas Kuzavas made Free Throw.,33,53
0:09,-1,Justin Baker missed Three Point Jumper.,33,53
0:09,2598,Randall Gaskins Jr. Defensive Rebound.,33,53
0:04,-1,Foul on Nasir Alexander.,33,53
0:04,2598,Randall Gaskins Jr. missed Free Throw.,33,53
0:04,2598,St. Francis (PA) Deadball Team Rebound.,33,53
0:04,2598,Randall Gaskins Jr. made Free Throw.,33,54
0:00,-1,Logan Hunter missed Three Point Jumper.,33,54
0:00,-1,Chatham University Offensive Rebound.,33,54
0:00,2598,End of 1st half,33,54
19:48,2598,Georgios Angelou made Three Point Jumper. Assisted by Jamaal King.,33,57
19:33,-1,Alex Schoppen made Three Point Jumper. Assisted by Anthony Bomar.,36,57
19:13,2598,Georgios Angelou missed Three Point Jumper.,36,57
19:13,-1,Chatham University Defensive Rebound.,36,57
18:55,-1,Logan Hunter made Three Point Jumper. Assisted by Anthony Bomar.,39,57
18:27,2598,Jamaal King Turnover.,39,57
17:59,-1,Isaiah Brown missed Layup.,39,57
17:59,2598,Josh Nebo Block.,39,57
17:57,-1,Anthony Bomar Offensive Rebound.,39,57
17:54,-1,Anthony Bomar missed Jumper.,39,57
17:54,-1,Nasir Alexander Offensive Rebound.,39,57
17:39,-1,Nasir Alexander missed Jumper.,39,57
17:39,2598,Jamaal King Block.,39,57
17:37,2598,Josh Nebo Defensive Rebound.,39,57
17:32,2598,Isaiah Blackmon missed Jumper.,39,57
17:32,2598,Isaiah Blackmon Offensive Rebound.,39,57
17:31,-1,Foul on Alex Schoppen.,39,57
17:27,2598,Josh Nebo made Jumper. Assisted by Daniel Wallace.,39,59
17:11,-1,Alex Schoppen Turnover.,39,59
17:10,2598,Jamaal King Steal.,39,59
17:04,2598,Isaiah Blackmon made Three Point Jumper. Assisted by Jamaal King.,39,62
17:02,-1,Foul on Alex Schoppen.,39,62
16:55,2598,Isaiah Blackmon missed Free Throw.,39,62
16:55,-1,Logan Hunter Defensive Rebound.,39,62
16:45,-1,Isaiah Brown missed Three Point Jumper.,39,62
16:45,2598,Isaiah Blackmon Defensive Rebound.,39,62
16:42,2598,Isaiah Blackmon made Three Point Jumper. Assisted by Georgios Angelou.,39,65
16:33,-1,Nasir Alexander missed Layup.,39,65
16:33,-1,Chatham University Deadball Team Rebound.,39,65
16:31,2598,Foul on Georgios Angelou.,39,65
16:27,2598,Foul on Randall Gaskins Jr..,39,65
16:19,-1,Logan Hunter missed Layup.,39,65
16:19,2598,Randall Gaskins Jr. Block.,39,65
16:18,2598,Georgios Angelou Defensive Rebound.,39,65
16:13,2598,Jamaal King made Three Point Jumper. Assisted by Georgios Angelou.,39,68
15:56,-1,Josh Randall missed Three Point Jumper.,39,68
15:56,-1,Ian Schrenk Offensive Rebound.,39,68
15:51,-1,Isaiah Brown made Three Point Jumper. Assisted by Ian Schrenk.,42,68
15:21,2598,Jamaal King missed Three Point Jumper.,42,68
15:21,2598,Josh Nebo Offensive Rebound.,42,68
15:15,2598,Georgios Angelou made Three Point Jumper. Assisted by Josh Nebo.,42,71
14:57,-1,Isaiah Brown missed Layup.,42,71
14:57,2598,Daniel Wallace Defensive Rebound.,42,71
14:42,2598,Georgios Angelou made Three Point Jumper.,42,74
14:23,-1,Isaiah Brown missed Three Point Jumper.,42,74
14:23,-1,Anthony Bomar Offensive Rebound.,42,74
14:06,-1,Reggie Rogers Turnover.,42,74
13:47,2598,Randall Gaskins Jr. missed Layup.,42,74
13:47,-1,Ian Schrenk Defensive Rebound.,42,74
13:46,-1,Foul on Buzz Walker.,42,74
13:46,-1,Buzz Walker Turnover.,42,74
13:30,2598,Deivydas Kuzavas missed Jumper.,42,74
13:30,-1,Anthony Bomar Defensive Rebound.,42,74
13:20,2598,Foul on Randall Gaskins Jr..,42,74
13:20,-1,Ian Schrenk made Free Throw.,43,74
13:20,-1,Ian Schrenk missed Free Throw.,43,74
13:20,2598,Deivydas Kuzavas Defensive Rebound.,43,74
13:13,-1,Foul on Ian Schrenk.,43,74
12:59,2598,Andre Wolford made Layup.,43,76
12:49,-1,Buzz Walker Turnover.,43,76
12:45,2598,Randall Gaskins Jr. Steal.,43,76
12:44,2598,Keith Braxton made Layup. Assisted by Randall Gaskins Jr..,43,78
12:20,-1,Ian Schrenk Turnover.,43,78
12:19,2598,Scott Meredith Steal.,43,78
12:14,2598,Randall Gaskins Jr. made Layup. Assisted by Scott Meredith.,43,80
12:07,-1,Chatham University  Timeout,43,80
12:02,-1,Logan Hunter missed Layup.,43,80
12:02,2598,Keith Braxton Defensive Rebound.,43,80
11:59,2598,Andre Wolford made Three Point Jumper.,43,83
11:53,-1,Alex Schoppen made Three Point Jumper. Assisted by Brandon Jaijairam.,46,83
11:26,2598,Keith Braxton made Layup.,46,85
11:06,-1,Brandon Jaijairam missed Three Point Jumper.,46,85
11:06,2598,Keith Braxton Defensive Rebound.,46,85
10:24,-1,Foul on Jack Ridenour.,46,85
10:24,2598,Official TV Timeout,46,85
10:24,2598,Deivydas Kuzavas missed Free Throw.,46,85
10:24,2598,St. Francis (PA) Deadball Team Rebound.,46,85
10:24,2598,Deivydas Kuzavas made Free Throw.,46,86
10:06,-1,Logan Hunter missed Jumper.,46,86
10:06,2598,Scott Meredith Defensive Rebound.,46,86
9:54,2598,Andre Wolford Turnover.,46,86
9:27,-1,Devin Shumaker made Layup.,48,86
9:02,2598,Andre Wolford made Three Point Jumper. Assisted by Randall Gaskins Jr..,48,89
8:42,-1,Alex Schoppen missed Three Point Jumper.,48,89
8:42,2598,Patrick Wrencher Defensive Rebound.,48,89
8:32,2598,Andre Wolford missed Three Point Jumper.,48,89
8:32,2598,Randall Gaskins Jr. Offensive Rebound.,48,89
8:28,2598,Randall Gaskins Jr. missed Dunk.,48,89
8:28,2598,Andre Wolford Offensive Rebound.,48,89
8:16,2598,Andre Wolford made Layup.,48,91
8:11,-1,Chatham University  Turnover.,48,91
8:07,2598,Scott Meredith made Three Point Jumper. Assisted by Patrick Wrencher.,48,94
7:52,-1,Brandon Jaijairam missed Three Point Jumper.,48,94
7:52,2598,Scott Meredith Defensive Rebound.,48,94
7:42,2598,Michael Klebon missed Three Point Jumper.,48,94
7:42,-1,Devin Shumaker Defensive Rebound.,48,94
7:35,-1,Brandon Jaijairam made Three Point Jumper. Assisted by Jack Ridenour.,51,94
7:24,2598,Scott Meredith missed Three Point Jumper.,51,94
7:24,-1,Devin Shumaker Defensive Rebound.,51,94
7:08,-1,Andrew Guanci made Three Point Jumper. Assisted by Brandon Jaijairam.,54,94
6:46,2598,Patrick Wrencher missed Layup.,54,94
6:46,-1,Andrew Guanci Defensive Rebound.,54,94
6:40,-1,Alex Schoppen made Layup. Assisted by Brandon Jaijairam.,56,94
6:22,2598,Jamaal King made Three Point Jumper. Assisted by Michael Klebon.,56,97
6:08,-1,Brandon Jaijairam made Three Point Jumper.,59,97
5:48,2598,Michael Klebon missed Jumper.,59,97
5:48,2598,Patrick Wrencher Offensive Rebound.,59,97
5:41,2598,Andre Wolford made Layup.,59,99
5:22,-1,Brandon Jaijairam missed Three Point Jumper.,59,99
5:22,2598,Andre Wolford Defensive Rebound.,59,99
5:12,2598,Michael Klebon made Three Point Jumper. Assisted by Keith Braxton.,59,102
5:00,-1,Chatham University  Timeout,59,102
4:53,-1,Rj Dimapilis missed Three Point Jumper.,59,102
4:53,2598,Tre McKeithen Defensive Rebound.,59,102
4:45,2598,Daniel Wallace missed Layup.,59,102
4:41,2598,St. Francis (PA) Offensive Rebound.,59,102
4:41,-1,Foul on Andrew Guanci.,59,102
4:35,2598,Deon Baker made Layup.,59,104
4:28,-1,Buzz Walker missed Layup.,59,104
4:28,-1,Chatham University Offensive Rebound.,59,104
4:25,-1,William Tate missed Layup.,59,104
4:25,2598,Daniel Wallace Defensive Rebound.,59,104
4:18,2598,Deon Baker made Layup.,59,106
4:18,-1,Foul on Devin Shumaker.,59,106
4:18,2598,Deon Baker made Free Throw.,59,107
4:00,2598,Foul on Tre McKeithen.,59,107
4:00,-1,William Tate missed Free Throw.,59,107
4:00,-1,Chatham University Deadball Team Rebound.,59,107
4:00,-1,William Tate missed Free Throw.,59,107
4:00,2598,Daniel Wallace Defensive Rebound.,59,107
3:57,-1,Foul on William Tate.,59,107
3:57,2598,Daniel Wallace missed Free Throw.,59,107
3:57,-1,Buzz Walker Defensive Rebound.,59,107
3:48,-1,William Tate missed Layup.,59,107
3:48,2598,Daniel Wallace Defensive Rebound.,59,107
3:41,2598,Foul on Georgios Angelou.,59,107
3:41,2598,Georgios Angelou Turnover.,59,107
3:35,-1,William Tate missed Jumper.,59,107
3:35,2598,Michael Klebon Defensive Rebound.,59,107
3:18,2598,Deon Baker made Layup. Assisted by Georgios Angelou.,59,109
3:08,-1,Rj Dimapilis missed Three Point Jumper.,59,109
3:08,2598,Daniel Wallace Defensive Rebound.,59,109
3:00,2598,Daniel Wallace Turnover.,59,109
2:59,-1,Madison Mlinac Steal.,59,109
2:55,-1,Buzz Walker missed Three Point Jumper.,59,109
2:55,-1,William Tate Offensive Rebound.,59,109
2:49,-1,William Tate missed Jumper.,59,109
2:49,2598,Daniel Wallace Block.,59,109
2:47,2598,Georgios Angelou Defensive Rebound.,59,109
2:40,2598,Daniel Wallace made Layup. Assisted by Georgios Angelou.,59,111
2:18,-1,Buzz Walker missed Three Point Jumper.,59,111
2:18,2598,Tre McKeithen Defensive Rebound.,59,111
2:00,2598,Michael Klebon made Three Point Jumper. Assisted by Deon Baker.,59,114
1:45,-1,Chatham University  Timeout,59,114
1:27,-1,Foul on Omari Pierre-Louis.,59,114
1:27,-1,Omari Pierre-Louis Turnover.,59,114
1:11,2598,Tre McKeithen missed Three Point Jumper.,59,114
1:11,-1,Madison Mlinac Defensive Rebound.,59,114
1:03,-1,Thomas Carpenter missed Three Point Jumper.,59,114
1:03,2598,Georgios Angelou Defensive Rebound.,59,114
0:53,2598,Tre McKeithen made Three Point Jumper. Assisted by Georgios Angelou.,59,117
0:42,-1,Madison Mlinac missed Three Point Jumper.,59,117
0:42,2598,Tre McKeithen Defensive Rebound.,59,117
0:38,-1,Foul on Thomas Carpenter.,59,117
0:38,2598,Tre McKeithen made Free Throw.,59,118
0:38,2598,Tre McKeithen made Free Throw.,59,119
0:32,-1,Thomas Carpenter missed Three Point Jumper.,59,119
0:32,2598,Deon Baker Defensive Rebound.,59,119
0:00,2598,End of Game,59,119
