Montana Tech,Error,Utah Valley,3084
time,team_id,description,h_score,a_score
19:42,3084,Jake Toolson made Layup. Assisted by Kenneth Ogbe.,0,2
19:42,-1,Foul on Trent Molesworth.,0,2
19:42,3084,Jake Toolson made Free Throw.,0,3
19:34,-1,Trent Molesworth missed Three Point Jumper.,0,3
19:34,-1,Montana Tech Offensive Rebound.,0,3
19:28,-1,Chris O'Neill Turnover.,0,3
19:27,3084,Kenneth Ogbe Steal.,0,3
19:20,3084,Foul on Kenneth Ogbe.,0,3
19:20,3084,Kenneth Ogbe Turnover.,0,3
19:03,-1,Dylan Pannabecker missed Three Point Jumper.,0,3
19:03,3084,Akolda Manyang Defensive Rebound.,0,3
18:56,3084,Kenneth Ogbe missed Three Point Jumper.,0,3
18:56,3084,Kenneth Ogbe Offensive Rebound.,0,3
18:48,-1,Foul on Dylan Pannabecker.,0,3
18:48,3084,Kenneth Ogbe made Free Throw.,0,4
18:48,3084,Kenneth Ogbe missed Free Throw.,0,4
18:48,-1,Trent Molesworth Defensive Rebound.,0,4
18:38,-1,Jake Miles made Three Point Jumper. Assisted by John Chapman.,3,4
18:12,3084,Kenneth Ogbe made Layup. Assisted by Brandon Randolph.,3,6
17:52,-1,Chris O'Neill missed Layup.,3,6
17:52,3084,Akolda Manyang Block.,3,6
17:50,3084,Kenneth Ogbe Defensive Rebound.,3,6
17:42,3084,Akolda Manyang made Layup. Assisted by Jake Toolson.,3,8
17:26,-1,Trent Molesworth missed Three Point Jumper.,3,8
17:26,3084,Akolda Manyang Defensive Rebound.,3,8
17:18,3084,Foul on Jake Toolson.,3,8
17:18,3084,Jake Toolson Turnover.,3,8
17:08,-1,Jake Miles missed Three Point Jumper.,3,8
17:08,3084,Kenneth Ogbe Defensive Rebound.,3,8
17:01,3084,Kenneth Ogbe made Jumper.,3,10
16:58,-1,Foul on John Chapman.,3,10
16:58,3084,Kenneth Ogbe missed Free Throw.,3,10
16:58,3084,Akolda Manyang Offensive Rebound.,3,10
16:53,3084,Akolda Manyang Turnover.,3,10
16:29,-1,Carson Dummer missed Layup.,3,10
16:29,3084,Jake Toolson Block.,3,10
16:27,3084,Jake Toolson Defensive Rebound.,3,10
16:24,3084,Brandon Randolph Turnover.,3,10
16:01,-1,Nick Fitts made Three Point Jumper. Assisted by Carson Dummer.,6,10
15:42,3084,Akolda Manyang made Layup. Assisted by Kenneth Ogbe.,6,12
15:30,-1,Foul on Nick Fitts.,6,12
15:30,-1,Nick Fitts Turnover.,6,12
15:30,3084,Official TV Timeout,6,12
15:03,3084,Kenneth Ogbe missed Three Point Jumper.,6,12
15:03,3084,Jake Toolson Offensive Rebound.,6,12
14:56,3084,Jake Toolson Turnover.,6,12
14:39,-1,Carson Dummer made Three Point Jumper. Assisted by Chris O'Neill.,9,12
14:22,3084,Jake Toolson missed Jumper.,9,12
14:22,3084,Akolda Manyang Offensive Rebound.,9,12
14:17,3084,Akolda Manyang made Dunk.,9,14
14:02,-1,Chris O'Neill missed Layup.,9,14
14:02,3084,Conner Toolson Defensive Rebound.,9,14
13:56,3084,Conner Toolson Turnover.,9,14
13:55,-1,Derrius Colins Steal.,9,14
13:51,-1,Derrius Colins made Layup.,11,14
13:35,3084,Jake Toolson missed Three Point Jumper.,11,14
13:35,-1,Chris O'Neill Defensive Rebound.,11,14
13:18,-1,Carson Dummer missed Jumper.,11,14
13:18,3084,Jake Toolson Defensive Rebound.,11,14
13:07,3084,Akolda Manyang made Jumper. Assisted by Jake Toolson.,11,16
12:41,-1,Chris O'Neill made Layup.,13,16
12:17,3084,Jake Toolson made Layup.,13,18
12:02,-1,John Chapman made Jumper. Assisted by Carson Dummer.,15,18
11:41,3084,Kenneth Ogbe made Layup. Assisted by Akolda Manyang.,15,20
11:18,-1,Carson Dummer made Jumper. Assisted by Chris O'Neill.,17,20
10:49,3084,Conner Toolson made Layup. Assisted by Brandon Randolph.,17,22
10:17,-1,Derrius Colins Turnover.,17,22
10:15,3084,Official TV Timeout,17,22
10:05,3084,Ben Nakwaasah missed Three Point Jumper.,17,22
10:05,3084,Zach Nelson Offensive Rebound.,17,22
10:01,-1,Foul on Jake Miles.,17,22
10:01,3084,Zach Nelson made Free Throw.,17,23
10:01,3084,Zach Nelson missed Free Throw.,17,23
10:01,-1,Dylan Pannabecker Defensive Rebound.,17,23
9:41,-1,Jake Miles made Jumper. Assisted by Chris O'Neill.,19,23
9:15,3084,Ben Nakwaasah made Three Point Jumper. Assisted by Brandon Randolph.,19,26
8:52,-1,Jake Miles Turnover.,19,26
8:23,3084,Zach Nelson Turnover.,19,26
8:21,-1,Chris O'Neill Steal.,19,26
8:11,-1,Jake Miles Turnover.,19,26
8:03,3084,Zach Nelson Turnover.,19,26
7:51,-1,Chris O'Neill missed Jumper.,19,26
7:51,-1,Taylor England Offensive Rebound.,19,26
7:41,-1,Dylan Pannabecker missed Layup.,19,26
7:41,3084,Isaac Neilson Defensive Rebound.,19,26
7:33,3084,Brandon Randolph Turnover.,19,26
7:32,-1,Jake Miles Steal.,19,26
7:29,-1,Jake Miles missed Three Point Jumper.,19,26
7:29,3084,Zach Nelson Defensive Rebound.,19,26
7:07,3084,Kenneth Ogbe made Three Point Jumper. Assisted by Isaac Neilson.,19,29
6:46,-1,John Chapman missed Three Point Jumper.,19,29
6:46,3084,Isaac Neilson Defensive Rebound.,19,29
6:27,3084,Kenneth Ogbe missed Layup.,19,29
6:27,3084,Isaac Neilson Offensive Rebound.,19,29
6:24,3084,Isaac Neilson missed Layup.,19,29
6:24,-1,Jake Miles Defensive Rebound.,19,29
6:19,3084,Foul on Ben Nakwaasah.,19,29
6:19,3084,Official TV Timeout,19,29
6:00,-1,Jake Miles missed Layup.,19,29
6:00,3084,Jake Toolson Block.,19,29
5:56,-1,John Chapman Offensive Rebound.,19,29
5:53,-1,John Chapman made Three Point Jumper.,22,29
5:33,-1,Foul on Derrius Colins.,22,29
5:20,3084,Jake Toolson made Three Point Jumper. Assisted by Ben Nakwaasah.,22,32
5:13,-1,Nick Fitts Turnover.,22,32
5:12,3084,Conner Toolson Steal.,22,32
5:10,3084,Conner Toolson made Layup.,22,34
5:02,-1,Montana Tech  Timeout,22,34
4:59,-1,Nick Fitts missed Jumper.,22,34
4:59,-1,Montana Tech Offensive Rebound.,22,34
4:41,-1,Trent Molesworth missed Jumper.,22,34
4:41,3084,Akolda Manyang Defensive Rebound.,22,34
4:24,3084,Akolda Manyang made Layup. Assisted by Conner Toolson.,22,36
4:09,-1,Trent Molesworth missed Three Point Jumper.,22,36
4:09,3084,Zach Nelson Defensive Rebound.,22,36
3:56,3084,Ben Nakwaasah missed Layup.,22,36
3:56,-1,John Chapman Defensive Rebound.,22,36
3:39,-1,Jake Miles missed Three Point Jumper.,22,36
3:39,-1,John Chapman Offensive Rebound.,22,36
3:33,-1,John Chapman missed Three Point Jumper.,22,36
3:30,3084,Akolda Manyang Defensive Rebound.,22,36
3:30,-1,Foul on Trent Molesworth.,22,36
3:24,3084,Official TV Timeout,22,36
3:24,3084,Akolda Manyang made Free Throw.,22,37
3:24,3084,Akolda Manyang missed Free Throw.,22,37
3:24,-1,Carson Dummer Defensive Rebound.,22,37
3:08,-1,Dylan Pannabecker missed Layup.,22,37
3:01,-1,Montana Tech Offensive Rebound.,22,37
3:00,-1,Dylan Pannabecker Turnover.,22,37
2:39,3084,Akolda Manyang missed Jumper.,22,37
2:39,3084,Utah Valley Offensive Rebound.,22,37
2:37,-1,Foul on Dylan Pannabecker.,22,37
2:37,3084,Conner Toolson made Free Throw.,22,38
2:37,3084,Conner Toolson made Free Throw.,22,39
2:16,-1,Chris O'Neill Turnover.,22,39
2:10,3084,Akolda Manyang Steal.,22,39
2:06,-1,Foul on Dylan Pannabecker.,22,39
2:06,-1,Montana Tech  Timeout,22,39
2:06,3084,Conner Toolson made Free Throw.,22,40
2:06,3084,Conner Toolson made Free Throw.,22,41
2:06,3084,Conner Toolson made Free Throw.,22,42
1:45,-1,Chris O'Neill Turnover.,22,42
1:44,3084,Conner Toolson Steal.,22,42
1:42,3084,Brandon Randolph made Layup. Assisted by Kenneth Ogbe.,22,44
1:08,-1,Carson Dummer missed Jumper.,22,44
1:08,3084,Jake Toolson Defensive Rebound.,22,44
0:47,3084,Akolda Manyang Turnover.,22,44
0:43,-1,John Chapman Steal.,22,44
0:40,-1,Jake Miles made Three Point Jumper. Assisted by John Chapman.,25,44
0:14,3084,Kenneth Ogbe made Three Point Jumper. Assisted by Jake Toolson.,25,47
0:03,-1,Jake Miles missed Three Point Jumper.,25,47
0:00,3084,Utah Valley Deadball Team Rebound.,25,47
0:00,3084,End of 1st half,25,47
19:50,-1,John Chapman missed Three Point Jumper.,25,47
19:50,-1,Derrius Colins Offensive Rebound.,25,47
19:45,-1,Derrius Colins made Layup.,27,47
19:20,-1,Foul on Taylor England.,27,47
19:18,-1,Foul on Taylor England.,27,47
19:13,3084,Conner Toolson made Layup. Assisted by Jake Toolson.,27,49
18:51,3084,Foul on Brandon Randolph.,27,49
18:34,-1,Chris O'Neill missed Three Point Jumper.,27,49
18:06,3084,Conner Toolson Defensive Rebound.,27,49
17:57,-1,Foul on Chris O'Neill.,27,49
17:57,3084,Jake Toolson made Free Throw.,27,50
17:57,3084,Jake Toolson made Free Throw.,27,51
17:45,-1,Taylor England Turnover.,27,51
17:44,3084,Jake Toolson Steal.,27,51
17:43,3084,Jake Toolson missed Layup.,27,51
17:43,-1,Taylor England Block.,27,51
17:40,-1,Jake Miles Defensive Rebound.,27,51
17:36,-1,Derrius Colins missed Layup.,27,51
17:36,3084,Jake Toolson Defensive Rebound.,27,51
17:27,3084,Kenneth Ogbe missed Layup.,27,51
17:27,3084,Brandon Randolph Offensive Rebound.,27,51
17:22,3084,Kenneth Ogbe made Layup. Assisted by Brandon Randolph.,27,53
16:56,-1,Dylan Pannabecker made Layup.,29,53
16:47,3084,Akolda Manyang missed Layup.,29,53
16:47,-1,Jake Miles Defensive Rebound.,29,53
16:31,-1,Derrius Colins Turnover.,29,53
16:15,3084,Akolda Manyang missed Jumper.,29,53
16:15,-1,John Chapman Defensive Rebound.,29,53
16:03,-1,Dylan Pannabecker Turnover.,29,53
16:02,3084,Brandon Randolph Steal.,29,53
16:00,3084,Official TV Timeout,29,53
16:00,3084,Brandon Randolph made Free Throw.,29,54
16:00,3084,Brandon Randolph made Free Throw.,29,55
15:58,-1,Foul on Chris O'Neill.,29,55
15:46,-1,Derrius Colins missed Three Point Jumper.,29,55
15:46,3084,Conner Toolson Defensive Rebound.,29,55
15:27,3084,Kenneth Ogbe made Layup.,29,57
14:56,-1,Chris O'Neill missed Jumper.,29,57
14:56,3084,Brandon Randolph Defensive Rebound.,29,57
14:49,3084,Brandon Randolph missed Layup.,29,57
14:49,3084,Akolda Manyang Offensive Rebound.,29,57
14:46,3084,Akolda Manyang missed Two Point Tip Shot.,29,57
14:46,3084,Brandon Randolph Offensive Rebound.,29,57
14:44,3084,Brandon Randolph made Layup.,29,59
14:32,-1,Carson Dummer Turnover.,29,59
14:31,3084,Jake Toolson Steal.,29,59
14:28,3084,Jake Toolson made Dunk.,29,61
14:17,-1,Montana Tech  Timeout,29,61
14:05,-1,John Chapman missed Three Point Jumper.,29,61
14:05,3084,Zach Nelson Defensive Rebound.,29,61
13:47,3084,Ben Nakwaasah Turnover.,29,61
13:46,-1,Chris O'Neill Steal.,29,61
13:39,-1,Chris O'Neill made Layup.,31,61
13:39,3084,Foul on Ben Nakwaasah.,31,61
13:39,-1,Chris O'Neill missed Free Throw.,31,61
13:39,3084,Isaac Neilson Defensive Rebound.,31,61
13:22,3084,Foul on Zach Nelson.,31,61
13:22,3084,Zach Nelson Turnover.,31,61
13:04,-1,Nick Fitts missed Three Point Jumper.,31,61
13:04,3084,Ben Nakwaasah Defensive Rebound.,31,61
12:58,-1,Foul on Trent Molesworth.,31,61
12:42,3084,Isaac Neilson made Layup. Assisted by Zach Nelson.,31,63
12:21,-1,Jake Miles missed Three Point Jumper.,31,63
12:21,3084,Cory Calvert Defensive Rebound.,31,63
12:14,3084,Ben Nakwaasah missed Layup.,31,63
12:14,-1,Nick Fitts Defensive Rebound.,31,63
12:05,-1,John Chapman missed Three Point Jumper.,31,63
12:05,3084,Cory Calvert Defensive Rebound.,31,63
11:59,3084,Brandon Randolph made Layup. Assisted by Zach Nelson.,31,65
11:38,-1,Dylan Pannabecker made Layup.,33,65
11:03,3084,Brandon Randolph made Jumper.,33,67
10:54,3084,Official TV Timeout,33,67
10:49,-1,Nick Fitts Turnover.,33,67
10:49,-1,Foul on Nick Fitts.,33,67
10:42,3084,Zach Nelson Turnover.,33,67
10:35,-1,Taylor England missed Jumper.,33,67
10:35,3084,Isaac Neilson Block.,33,67
10:32,3084,Isaac Neilson Defensive Rebound.,33,67
10:21,3084,Ben Nakwaasah made Three Point Jumper. Assisted by Zach Nelson.,33,70
9:54,-1,John Chapman made Jumper. Assisted by Taylor England.,35,70
9:44,3084,Isaac Neilson missed Layup.,35,70
9:44,3084,Isaac Neilson Offensive Rebound.,35,70
9:42,3084,Isaac Neilson made Layup.,35,72
9:13,-1,John Chapman made Three Point Jumper.,38,72
8:52,3084,Isaac Neilson made Layup. Assisted by Ben Nakwaasah.,38,74
8:33,3084,Foul on Ben Nakwaasah.,38,74
8:08,-1,Kale Guldseth missed Three Point Jumper.,38,74
8:08,3084,Joonas Tahvanainen Defensive Rebound.,38,74
7:52,3084,Ben Nakwaasah missed Three Point Jumper.,38,74
7:52,-1,Chris O'Neill Defensive Rebound.,38,74
7:47,-1,Chris O'Neill missed Layup.,38,74
7:47,3084,Joonas Tahvanainen Defensive Rebound.,38,74
7:38,3084,Joonas Tahvanainen missed Layup.,38,74
7:38,-1,Taylor England Block.,38,74
7:35,3084,Joonas Tahvanainen Offensive Rebound.,38,74
7:35,-1,Foul on Kale Guldseth.,38,74
7:32,3084,Official TV Timeout,38,74
7:32,3084,Joonas Tahvanainen missed Free Throw.,38,74
7:32,3084,Isaac Neilson Offensive Rebound.,38,74
7:30,-1,Foul on Taylor England.,38,74
7:30,3084,Isaac Neilson made Free Throw.,38,75
7:30,3084,Isaac Neilson missed Free Throw.,38,75
7:30,-1,Carson Dummer Defensive Rebound.,38,75
7:05,-1,Carson Dummer missed Jumper.,38,75
7:05,3084,Mckay Johnson Defensive Rebound.,38,75
6:40,3084,Cory Calvert Turnover.,38,75
6:30,-1,Jake Miles made Three Point Jumper. Assisted by Chris O'Neill.,41,75
6:17,-1,Foul on Dylan Pannabecker.,41,75
6:17,3084,Daniel Nyman made Free Throw.,41,76
6:17,3084,Daniel Nyman made Free Throw.,41,77
5:50,3084,Foul on Joonas Tahvanainen.,41,77
5:48,3084,Foul on Isaac Neilson.,41,77
5:48,-1,Carson Dummer made Free Throw.,42,77
5:48,-1,Carson Dummer made Free Throw.,43,77
5:18,3084,Cory Calvert made Layup.,43,79
4:55,-1,Jake Miles made Three Point Jumper. Assisted by Kale Guldseth.,46,79
4:40,3084,Cory Calvert missed Jumper.,46,79
4:40,3084,Joonas Tahvanainen Offensive Rebound.,46,79
4:36,3084,Joonas Tahvanainen made Two Point Tip Shot.,46,81
4:14,3084,Foul on Richard Harward.,46,81
4:14,-1,Carson Dummer made Free Throw.,47,81
4:14,-1,Carson Dummer missed Free Throw.,47,81
4:14,3084,Joonas Tahvanainen Defensive Rebound.,47,81
3:53,3084,Mckay Johnson Turnover.,47,81
3:52,3084,Official TV Timeout,47,81
3:31,-1,Derrius Colins missed Jumper.,47,81
3:31,3084,Daniel Nyman Defensive Rebound.,47,81
3:18,3084,Richard Harward missed Layup.,47,81
3:18,-1,Carson Dummer Defensive Rebound.,47,81
3:03,-1,Jake Miles made Three Point Jumper. Assisted by Carson Dummer.,50,81
2:34,3084,Daniel Nyman missed Three Point Jumper.,50,81
2:34,-1,Kale Guldseth Defensive Rebound.,50,81
2:11,-1,Nick Fitts missed Three Point Jumper.,50,81
2:11,-1,Montana Tech Offensive Rebound.,50,81
1:59,3084,Foul on Mckay Johnson.,50,81
1:59,-1,Jake Miles made Free Throw.,51,81
1:59,-1,Jake Miles made Free Throw.,52,81
1:47,3084,Foul on Daniel Nyman.,52,81
1:47,3084,Daniel Nyman Turnover.,52,81
1:46,-1,Jake Miles missed Three Point Jumper.,52,81
1:46,3084,Cory Calvert Defensive Rebound.,52,81
1:07,3084,Mckay Johnson Turnover.,52,81
1:06,-1,Kale Guldseth Steal.,52,81
1:05,-1,Kale Guldseth made Layup.,54,81
0:44,3084,Cory Calvert missed Three Point Jumper.,54,81
0:44,3084,Joonas Tahvanainen Offensive Rebound.,54,81
0:39,-1,Foul on Nick Fitts.,54,81
0:39,3084,Joonas Tahvanainen made Free Throw.,54,82
0:39,3084,Joonas Tahvanainen missed Free Throw.,54,82
0:39,3084,Mckay Johnson Offensive Rebound.,54,82
0:21,3084,Richard Harward missed Layup.,54,82
0:21,3084,Richard Harward Offensive Rebound.,54,82
0:18,3084,Richard Harward made Layup.,54,84
0:00,-1,Kale Guldseth made Jumper. Assisted by Nick Fitts.,56,84
0:00,3084,End of Game,56,84
