Army,2405,Monmouth,349
time,team_id,description,h_score,a_score
19:41,2405,Chris Brady made Jumper.,0,2
19:12,349,Mac Hoffman missed Jumper.,0,2
19:12,2405,Chris Brady Defensive Rebound.,0,2
18:59,2405,Je'lon Hornbeak Turnover.,0,2
18:58,349,Mac Hoffman Steal.,0,2
18:46,349,Jacob Kessler Turnover.,0,2
18:28,2405,Chris Brady made Three Point Jumper. Assisted by Micah Seaborn.,0,5
18:04,349,Thomas Funk missed Three Point Jumper.,0,5
18:04,2405,Micah Seaborn Defensive Rebound.,0,5
17:55,349,Foul on Jacob Kessler.,0,5
17:55,2405,Micah Seaborn missed Free Throw.,0,5
17:55,2405,Monmouth Deadball Team Rebound.,0,5
17:55,2405,Micah Seaborn made Free Throw.,0,6
17:40,349,John Emezie Turnover.,0,6
17:38,2405,Justin Robinson Steal.,0,6
17:36,2405,Micah Seaborn made Layup. Assisted by Je'lon Hornbeak.,0,8
17:22,349,Jordan Fox made Three Point Jumper. Assisted by John Emezie.,3,8
17:03,2405,Chris Brady made Jumper. Assisted by Justin Robinson.,3,10
16:47,349,Thomas Funk Turnover.,3,10
16:47,349,Foul on Thomas Funk.,3,10
16:36,2405,Je'lon Hornbeak made Three Point Jumper. Assisted by Micah Seaborn.,3,13
16:02,349,Kennedy Edwards Turnover.,3,13
15:56,2405,Micah Seaborn missed Jumper.,3,13
15:56,349,Kennedy Edwards Defensive Rebound.,3,13
15:44,349,Jordan Fox made Three Point Jumper. Assisted by Kennedy Edwards.,6,13
15:36,2405,Micah Seaborn missed Three Point Jumper.,6,13
15:36,2405,Je'lon Hornbeak Offensive Rebound.,6,13
15:31,2405,Diago Quinn missed Layup.,6,13
15:31,349,Matthew Wilson Defensive Rebound.,6,13
15:17,349,Jacob Kessler missed Layup.,6,13
15:17,2405,Diago Quinn Defensive Rebound.,6,13
15:11,2405,Je'lon Hornbeak missed Jumper.,6,13
15:11,349,Matthew Wilson Defensive Rebound.,6,13
15:01,349,Jacob Kessler missed Three Point Jumper.,6,13
15:01,349,Matthew Wilson Offensive Rebound.,6,13
14:57,349,Matthew Wilson made Layup.,8,13
14:34,2405,Je'lon Hornbeak made Three Point Jumper. Assisted by Pierre Sarr.,8,16
14:26,349,Jacob Kessler Turnover.,8,16
14:26,349,Foul on Jacob Kessler.,8,16
14:26,2405,Official TV Timeout,8,16
14:10,2405,Collin Stewart missed Layup.,8,16
14:10,349,Matthew Wilson Block.,8,16
14:08,349,Matthew Wilson Defensive Rebound.,8,16
14:03,349,Adam Roe missed Three Point Jumper.,8,16
14:03,349,Luke Morrison Offensive Rebound.,8,16
13:56,349,Thomas Funk Turnover.,8,16
13:49,2405,Sam Ibiezugbe missed Layup.,8,16
13:49,349,Luke Morrison Defensive Rebound.,8,16
13:34,349,Thomas Funk missed Jumper.,8,16
13:34,2405,Justin Robinson Block.,8,16
13:32,349,Army Offensive Rebound.,8,16
13:22,349,Thomas Funk Turnover.,8,16
13:21,2405,Micah Seaborn Steal.,8,16
13:15,2405,Micah Seaborn missed Layup.,8,16
13:15,349,Luke Morrison Defensive Rebound.,8,16
13:09,349,Adam Roe made Layup.,10,16
13:01,2405,Justin Robinson Turnover.,10,16
12:59,349,Adam Roe Steal.,10,16
12:55,2405,Foul on Collin Stewart.,10,16
12:55,349,Adam Roe made Free Throw.,11,16
12:55,349,Adam Roe made Free Throw.,12,16
12:27,2405,Collin Stewart made Dunk. Assisted by Justin Robinson.,12,18
12:08,349,Adam Roe missed Three Point Jumper.,12,18
12:08,2405,Austin Tilghman Defensive Rebound.,12,18
11:58,2405,Chris Brady Turnover.,12,18
11:58,2405,Official TV Timeout,12,18
11:41,349,John Emezie made Jumper.,14,18
11:18,2405,Chris Brady missed Jumper.,14,18
11:18,349,Matthew Wilson Defensive Rebound.,14,18
11:04,349,Matthew Wilson missed Layup.,14,18
11:04,349,Matthew Wilson Offensive Rebound.,14,18
11:04,2405,Foul on Micah Seaborn.,14,18
10:59,2405,Foul on Chris Brady.,14,18
10:59,349,John Emezie made Free Throw.,15,18
10:59,349,John Emezie made Free Throw.,16,18
10:32,2405,Chris Brady made Layup. Assisted by Je'lon Hornbeak.,16,20
10:32,349,Foul on Mac Hoffman.,16,20
10:32,2405,Chris Brady made Free Throw.,16,21
10:23,349,Jordan Fox Turnover.,16,21
9:59,2405,Mustapha Traore Turnover.,16,21
9:48,349,Jordan Fox made Jumper. Assisted by Mac Hoffman.,18,21
9:34,2405,Je'lon Hornbeak made Layup.,18,23
9:24,349,Luke Morrison missed Three Point Jumper.,18,23
9:24,349,Thomas Funk Offensive Rebound.,18,23
9:11,349,Luke Morrison missed Three Point Jumper.,18,23
9:11,349,Mac Hoffman Offensive Rebound.,18,23
9:01,349,Jacob Kessler Turnover.,18,23
8:59,2405,Mustapha Traore Steal.,18,23
8:57,2405,Je'lon Hornbeak missed Three Point Jumper.,18,23
8:57,349,Army Defensive Rebound.,18,23
8:41,349,Thomas Funk Turnover.,18,23
8:40,2405,Mustapha Traore Steal.,18,23
8:35,2405,Je'lon Hornbeak missed Three Point Jumper.,18,23
8:35,349,Army Defensive Rebound.,18,23
8:17,349,Mac Hoffman missed Jumper.,18,23
8:17,349,Luke Morrison Offensive Rebound.,18,23
8:03,349,Thomas Funk missed Jumper.,18,23
8:03,349,Army Offensive Rebound.,18,23
7:59,2405,Official TV Timeout,18,23
7:40,349,Scott Mammel Turnover.,18,23
7:40,2405,Diago Quinn Steal.,18,23
7:40,349,Foul on Jordan Fox.,18,23
7:19,2405,Collin Stewart made Layup.,18,25
7:02,2405,Foul on Diago Quinn.,18,25
7:02,349,Kennedy Edwards missed Free Throw.,18,25
7:02,349,Army Deadball Team Rebound.,18,25
7:02,349,Kennedy Edwards made Free Throw.,19,25
6:54,2405,Pierre Sarr made Layup.,19,27
6:41,349,John Emezie missed Jumper.,19,27
6:41,2405,Austin Tilghman Defensive Rebound.,19,27
6:31,349,Foul on John Emezie.,19,27
6:22,2405,Austin Tilghman made Layup.,19,29
6:14,349,John Emezie missed Three Point Jumper.,19,29
6:14,349,Mac Hoffman Offensive Rebound.,19,29
6:09,349,Mac Hoffman missed Layup.,19,29
6:09,2405,Diago Quinn Block.,19,29
6:08,2405,Collin Stewart Defensive Rebound.,19,29
5:47,2405,Austin Tilghman missed Layup.,19,29
5:47,349,Mac Hoffman Defensive Rebound.,19,29
5:39,349,Jordan Fox made Three Point Jumper. Assisted by Scott Mammel.,22,29
5:35,349,Army  Timeout,22,29
5:20,2405,Je'lon Hornbeak missed Three Point Jumper.,22,29
5:20,349,Luke Morrison Defensive Rebound.,22,29
5:11,349,Luke Morrison missed Three Point Jumper.,22,29
5:11,2405,Micah Seaborn Defensive Rebound.,22,29
5:04,2405,Diago Quinn made Layup. Assisted by Micah Seaborn.,22,31
4:49,349,Thomas Funk missed Jumper.,22,31
4:49,349,Mac Hoffman Offensive Rebound.,22,31
4:36,349,Thomas Funk missed Three Point Jumper.,22,31
4:36,2405,Pierre Sarr Defensive Rebound.,22,31
4:17,2405,Pierre Sarr missed Three Point Jumper.,22,31
4:17,2405,Monmouth Offensive Rebound.,22,31
4:05,349,Foul on Jordan Fox.,22,31
4:05,2405,Micah Seaborn made Free Throw.,22,32
4:05,2405,Micah Seaborn missed Free Throw.,22,32
4:05,2405,Monmouth Deadball Team Rebound.,22,32
4:05,2405,Micah Seaborn made Free Throw.,22,33
3:41,349,Jacob Kessler missed Jumper.,22,33
3:41,2405,Je'lon Hornbeak Defensive Rebound.,22,33
3:37,349,Foul on Jordan Fox.,22,33
3:37,2405,Official TV Timeout,22,33
3:37,2405,Je'lon Hornbeak made Free Throw.,22,34
3:37,2405,Je'lon Hornbeak made Free Throw.,22,35
3:18,349,Scott Mammel missed Layup.,22,35
3:18,2405,Je'lon Hornbeak Block.,22,35
3:14,2405,Pierre Sarr Defensive Rebound.,22,35
3:09,349,Foul on Matthew Wilson.,22,35
3:09,2405,Micah Seaborn missed Free Throw.,22,35
3:09,2405,Monmouth Deadball Team Rebound.,22,35
3:09,2405,Micah Seaborn made Free Throw.,22,36
2:43,349,Matthew Wilson made Layup. Assisted by Thomas Funk.,24,36
2:43,2405,Foul on Diago Quinn.,24,36
2:43,349,Matthew Wilson missed Free Throw.,24,36
2:43,2405,Justin Robinson Defensive Rebound.,24,36
2:36,2405,Micah Seaborn missed Three Point Jumper.,24,36
2:36,349,Thomas Funk Defensive Rebound.,24,36
2:21,349,Thomas Funk Turnover.,24,36
2:10,2405,Je'lon Hornbeak made Dunk. Assisted by Justin Robinson.,24,38
2:01,349,Matthew Wilson made Layup. Assisted by Thomas Funk.,26,38
1:51,2405,Justin Robinson missed Layup.,26,38
1:51,349,Thomas Funk Defensive Rebound.,26,38
1:48,2405,Foul on Sam Ibiezugbe.,26,38
1:17,349,John Emezie missed Layup.,26,38
1:17,349,Jacob Kessler Offensive Rebound.,26,38
1:12,349,Jacob Kessler made Layup.,28,38
1:00,2405,Chris Brady missed Jumper.,28,38
1:00,349,Scott Mammel Defensive Rebound.,28,38
0:41,349,Thomas Funk made Layup.,30,38
0:09,2405,Je'lon Hornbeak missed Three Point Jumper.,30,38
0:09,349,Matthew Wilson Defensive Rebound.,30,38
0:04,349,Scott Mammel missed Three Point Jumper.,30,38
0:04,349,Jacob Kessler Offensive Rebound.,30,38
0:00,349,Jacob Kessler missed Jumper.,30,38
0:00,349,Army Deadball Team Rebound.,30,38
0:00,2405,End of 1st half,30,38
19:41,349,Thomas Funk missed Jumper.,30,38
19:41,2405,Pierre Sarr Defensive Rebound.,30,38
19:34,2405,Justin Robinson missed Three Point Jumper.,30,38
19:34,349,Jordan Fox Defensive Rebound.,30,38
19:26,349,John Emezie missed Three Point Jumper.,30,38
19:26,2405,Chris Brady Defensive Rebound.,30,38
19:13,2405,Micah Seaborn missed Layup.,30,38
