Navy,2430,UNC Greensboro,2426
time,team_id,description,h_score,a_score
19:45,2430,Jordy Kuiper missed Three Point Jumper.,0,0
19:45,2430,Marvin Smith Offensive Rebound.,0,0
19:28,2430,Diante Baldwin missed Three Point Jumper.,0,0
19:28,2430,Jordy Kuiper Offensive Rebound.,0,0
19:13,2430,Marvin Smith missed Three Point Jumper.,0,0
19:13,2426,Hasan Abdullah Defensive Rebound.,0,0
18:57,2426,Shawn Anderson missed Three Point Jumper.,0,0
18:57,2430,Marvin Smith Defensive Rebound.,0,0
18:47,2426,Foul on Tom Lacey.,0,0
18:35,2430,Diante Baldwin made Layup.,0,2
18:14,2426,Shawn Anderson made Jumper.,2,2
17:58,2430,Diante Baldwin Turnover.,2,2
17:58,2426,Ryan Pearson Steal.,2,2
17:39,2426,Shawn Anderson missed Layup.,2,2
17:39,2426,Shawn Anderson Offensive Rebound.,2,2
17:29,2426,Ryan Pearson missed Three Point Jumper.,2,2
17:29,2430,Marvin Smith Defensive Rebound.,2,2
17:14,2430,Francis Alonso missed Three Point Jumper.,2,2
17:14,2426,Shawn Anderson Defensive Rebound.,2,2
17:11,2430,Foul on Marvin Smith.,2,2
17:04,2426,Ryan Pearson missed Jumper.,2,2
17:04,2430,Diante Baldwin Defensive Rebound.,2,2
16:53,2430,Diante Baldwin made Jumper.,2,4
16:32,2426,Tom Lacey missed Layup.,2,4
16:32,2430,Jordy Kuiper Block.,2,4
16:32,2426,Navy Offensive Rebound.,2,4
16:21,2426,Tom Lacey missed Layup.,2,4
16:21,2430,R.J. White Block.,2,4
16:20,2430,Jordy Kuiper Defensive Rebound.,2,4
16:12,2426,Foul on Evan Wieck.,2,4
15:51,2430,Diante Baldwin missed Three Point Jumper.,2,4
15:51,2426,James Hemphill Defensive Rebound.,2,4
15:39,2426,Hasan Abdullah Turnover.,2,4
15:39,2430,Marvin Smith Steal.,2,4
15:18,2430,Francis Alonso missed Three Point Jumper.,2,4
15:18,2426,Zach Fong Defensive Rebound.,2,4
14:59,2426,James Hemphill made Jumper. Assisted by Hasan Abdullah.,4,4
14:31,2430,Marvin Smith missed Jumper.,4,4
14:31,2430,Marvin Smith Offensive Rebound.,4,4
14:29,2430,Marvin Smith made Layup.,4,6
14:13,2426,Shawn Anderson missed Three Point Jumper.,4,6
14:13,2426,James Hemphill Offensive Rebound.,4,6
13:56,2426,Evan Wieck made Layup. Assisted by Zach Fong.,6,6
13:42,2430,Demetrius Troy made Three Point Jumper. Assisted by Francis Alonso.,6,9
13:14,2426,Hasan Abdullah missed Three Point Jumper.,6,9
13:14,2430,Marvin Smith Defensive Rebound.,6,9
12:50,2430,Marvin Smith made Three Point Jumper. Assisted by Francis Alonso.,6,12
12:38,2426,Zach Fong missed Layup.,6,12
12:38,2430,R.J. White Defensive Rebound.,6,12
12:38,2426,Foul on James Hemphill.,6,12
12:21,2430,Jordy Kuiper made Jumper. Assisted by James Dickey.,6,14
11:54,2426,Zach Fong missed Three Point Jumper.,6,14
11:54,2430,Diante Baldwin Defensive Rebound.,6,14
11:47,2430,Demetrius Troy made Three Point Jumper. Assisted by Diante Baldwin.,6,17
11:43,2426,Navy  Timeout,6,17
11:22,2430,Foul on Demetrius Troy.,6,17
11:17,2426,James Hemphill Turnover.,6,17
10:55,2430,James Dickey made Dunk. Assisted by Demetrius Troy.,6,19
10:35,2426,Bryce Dulin missed Layup.,6,19
10:35,2430,James Dickey Block.,6,19
10:34,2426,Bryce Dulin Offensive Rebound.,6,19
10:31,2426,Nourse Fox missed Three Point Jumper.,6,19
10:31,2426,Zach Fong Offensive Rebound.,6,19
10:30,2430,Foul on Demetrius Troy.,6,19
10:28,2426,Zach Fong made Layup. Assisted by Nourse Fox.,8,19
10:00,2430,Jordy Kuiper Turnover.,8,19
10:00,2430,Foul on Jordy Kuiper.,8,19
9:42,2426,George Kiernan Turnover.,8,19
9:21,2430,R.J. White made Layup. Assisted by Malik Massey.,8,21
9:07,2426,Zach Fong missed Three Point Jumper.,8,21
9:07,2426,Tom Lacey Offensive Rebound.,8,21
9:05,2430,Foul on Diante Baldwin.,8,21
9:04,2430,Foul on Francis Alonso.,8,21
8:52,2426,Shawn Anderson missed Jumper.,8,21
8:52,2426,Evan Wieck Offensive Rebound.,8,21
8:39,2426,Shawn Anderson made Layup.,10,21
8:27,2430,R.J. White made Dunk. Assisted by Jordy Kuiper.,10,23
8:27,2426,Foul on Tom Lacey.,10,23
8:27,2430,R.J. White made Free Throw.,10,24
8:07,2426,Nourse Fox missed Three Point Jumper.,10,24
8:07,2430,Malik Massey Defensive Rebound.,10,24
8:00,2430,Marvin Smith Turnover.,10,24
8:00,2430,Foul on Marvin Smith.,10,24
7:57,2430,Official TV Timeout,10,24
7:38,2426,Ryan Pearson missed Three Point Jumper.,10,24
7:38,2430,Malik Massey Defensive Rebound.,10,24
7:20,2426,Foul on Hasan Abdullah.,10,24
7:14,2430,R.J. White missed Jumper.,10,24
7:14,2430,Lloyd Burgess Offensive Rebound.,10,24
7:12,2430,Lloyd Burgess missed Layup.,10,24
7:12,2430,Lloyd Burgess Offensive Rebound.,10,24
7:09,2430,Lloyd Burgess missed Layup.,10,24
7:09,2426,Shawn Anderson Defensive Rebound.,10,24
7:03,2426,George Kiernan made Three Point Jumper. Assisted by Shawn Anderson.,13,24
6:49,2430,Francis Alonso missed Three Point Jumper.,13,24
6:49,2426,Shawn Anderson Defensive Rebound.,13,24
6:47,2430,Foul on Lloyd Burgess.,13,24
6:47,2426,Shawn Anderson made Free Throw.,14,24
6:47,2426,Shawn Anderson made Free Throw.,15,24
6:23,2430,Malik Massey Turnover.,15,24
6:22,2426,Hasan Abdullah Steal.,15,24
6:19,2430,Foul on Malik Massey.,15,24
6:19,2426,Shawn Anderson missed Free Throw.,15,24
6:19,2426,Navy Deadball Team Rebound.,15,24
6:19,2426,Shawn Anderson made Free Throw.,16,24
5:57,2430,Garrett Collins missed Three Point Jumper.,16,24
5:57,2426,George Kiernan Defensive Rebound.,16,24
5:28,2430,Foul on Francis Alonso.,16,24
5:28,2426,Hasan Abdullah made Free Throw.,17,24
5:28,2426,Hasan Abdullah made Free Throw.,18,24
5:11,2430,Diante Baldwin Turnover.,18,24
4:49,2426,Bryce Dulin missed Layup.,18,24
4:49,2430,James Dickey Defensive Rebound.,18,24
4:40,2430,Demetrius Troy made Jumper.,18,26
4:28,2426,Hasan Abdullah Turnover.,18,26
4:26,2430,James Dickey Steal.,18,26
4:14,2426,Foul on Ryan Pearson.,18,26
3:44,2430,R.J. White made Jumper.,18,28
3:12,2426,Bryce Dulin made Jumper.,20,28
2:48,2430,Demetrius Troy missed Three Point Jumper.,20,28
2:48,2426,Ryan Pearson Defensive Rebound.,20,28
2:36,2430,Foul on Diante Baldwin.,20,28
2:36,2430,Official TV Timeout,20,28
2:36,2426,Bryce Dulin missed Free Throw.,20,28
2:36,2426,Navy Deadball Team Rebound.,20,28
2:36,2426,Bryce Dulin made Free Throw.,21,28
2:18,2430,R.J. White Turnover.,21,28
2:01,2426,George Kiernan made Three Point Jumper. Assisted by Nourse Fox.,24,28
1:29,2430,Demetrius Troy Turnover.,24,28
1:10,2426,George Kiernan missed Three Point Jumper.,24,28
1:10,2430,Demetrius Troy Defensive Rebound.,24,28
0:46,2430,Jordy Kuiper made Jumper. Assisted by James Dickey.,24,30
0:16,2426,Edward Alade missed Layup.,24,30
0:16,2430,James Dickey Block.,24,30
0:15,2426,Shawn Anderson Offensive Rebound.,24,30
0:11,2426,Shawn Anderson made Layup.,26,30
0:02,2430,Diante Baldwin made Jumper.,26,32
0:00,2430,End of 1st half,26,32
19:44,2430,R.J. White made Layup. Assisted by Marvin Smith.,26,34
19:13,2426,Hasan Abdullah missed Three Point Jumper.,26,34
19:13,2426,Evan Wieck Offensive Rebound.,26,34
19:11,2430,Foul on R.J. White.,26,34
19:10,2426,Shawn Anderson made Jumper. Assisted by Hasan Abdullah.,28,34
18:54,2430,R.J. White missed Layup.,28,34
18:54,2426,Hasan Abdullah Defensive Rebound.,28,34
18:42,2426,Shawn Anderson Turnover.,28,34
18:18,2430,Marvin Smith missed Layup.,28,34
18:18,2426,Evan Wieck Defensive Rebound.,28,34
18:10,2426,Shawn Anderson missed Layup.,28,34
18:10,2430,Diante Baldwin Defensive Rebound.,28,34
18:05,2426,Foul on Hasan Abdullah.,28,34
17:46,2430,Marvin Smith missed Three Point Jumper.,28,34
17:46,2430,Diante Baldwin Offensive Rebound.,28,34
17:36,2430,Francis Alonso missed Jumper.,28,34
17:36,2426,Shawn Anderson Defensive Rebound.,28,34
17:35,2430,Foul on Marvin Smith.,28,34
17:17,2426,Tom Lacey Turnover.,28,34
16:57,2430,Marvin Smith missed Three Point Jumper.,28,34
16:57,2426,Evan Wieck Defensive Rebound.,28,34
16:37,2426,Tom Lacey missed Layup.,28,34
16:37,2430,Jordy Kuiper Defensive Rebound.,28,34
16:22,2430,Foul on Jordy Kuiper.,28,34
16:22,2430,Jordy Kuiper Turnover.,28,34
16:03,2426,Ryan Pearson Turnover.,28,34
15:38,2430,Francis Alonso made Three Point Jumper. Assisted by James Dickey.,28,37
15:16,2426,Hasan Abdullah Turnover.,28,37
15:15,2430,R.J. White Steal.,28,37
15:07,2430,Francis Alonso Turnover.,28,37
15:07,2426,Hasan Abdullah Steal.,28,37
15:03,2426,Hasan Abdullah made Layup.,30,37
14:35,2430,Francis Alonso missed Three Point Jumper.,30,37
14:35,2430,R.J. White Offensive Rebound.,30,37
14:31,2430,Diante Baldwin made Three Point Jumper. Assisted by R.J. White.,30,40
14:13,2430,Foul on Francis Alonso.,30,40
14:13,2430,Official TV Timeout,30,40
13:41,2426,Zach Fong missed Three Point Jumper.,30,40
13:41,2430,UNC Greensboro Defensive Rebound.,30,40
13:11,2430,Demetrius Troy made Jumper. Assisted by Diante Baldwin.,30,42
12:53,2426,Bryce Dulin made Layup.,32,42
12:40,2430,R.J. White made Layup. Assisted by Demetrius Troy.,32,44
12:19,2426,James Hemphill Turnover.,32,44
12:18,2430,Demetrius Troy Steal.,32,44
11:57,2430,Demetrius Troy missed Three Point Jumper.,32,44
11:57,2430,James Dickey Offensive Rebound.,32,44
11:55,2426,Foul on James Hemphill.,32,44
11:54,2426,Foul on George Kiernan.,32,44
11:53,2430,Malik Massey made Layup. Assisted by Demetrius Troy.,32,46
11:48,2426,Bryce Dulin Turnover.,32,46
11:48,2430,Official TV Timeout,32,46
11:31,2430,Malik Massey made Three Point Jumper. Assisted by Demetrius Troy.,32,49
11:14,2426,Nourse Fox made Three Point Jumper.,35,49
10:44,2430,James Dickey made Layup.,35,51
10:33,2426,Shawn Anderson made Layup.,37,51
10:07,2430,Demetrius Troy made Three Point Jumper.,37,54
9:59,2430,Foul on Malik Massey.,37,54
9:55,2426,Bryce Dulin made Three Point Jumper. Assisted by Shawn Anderson.,40,54
9:26,2430,James Dickey missed Layup.,40,54
9:26,2430,Jordy Kuiper Offensive Rebound.,40,54
9:19,2430,James Dickey missed Dunk.,40,54
9:19,2430,Jordy Kuiper Offensive Rebound.,40,54
9:17,2426,Foul on George Kiernan.,40,54
9:17,2430,Jordy Kuiper missed Free Throw.,40,54
9:17,2430,UNC Greensboro Deadball Team Rebound.,40,54
9:17,2430,Jordy Kuiper made Free Throw.,40,55
9:01,2430,Foul on Francis Alonso.,40,55
9:01,2426,Tom Lacey made Free Throw.,41,55
9:01,2426,Tom Lacey made Free Throw.,42,55
8:32,2430,Diante Baldwin made Layup.,42,57
8:17,2426,Bryce Dulin made Three Point Jumper.,45,57
7:47,2430,James Dickey made Layup. Assisted by R.J. White.,45,59
7:16,2426,Nourse Fox missed Three Point Jumper.,45,59
7:16,2430,UNC Greensboro Defensive Rebound.,45,59
7:14,2430,Official TV Timeout,45,59
6:56,2430,Marvin Smith made Three Point Jumper. Assisted by Demetrius Troy.,45,62
6:37,2426,Tom Lacey Turnover.,45,62
6:37,2430,Demetrius Troy Steal.,45,62
6:33,2430,Diante Baldwin made Layup. Assisted by Demetrius Troy.,45,64
6:18,2430,Foul on R.J. White.,45,64
6:18,2426,Shawn Anderson made Free Throw.,46,64
6:18,2426,Shawn Anderson made Free Throw.,47,64
5:51,2430,James Dickey made Layup. Assisted by Marvin Smith.,47,66
5:41,2426,Evan Wieck missed Layup.,47,66
5:41,2430,Jordy Kuiper Defensive Rebound.,47,66
5:15,2430,Jordy Kuiper made Layup. Assisted by Diante Baldwin.,47,68
4:48,2426,George Kiernan made Layup.,49,68
4:25,2430,James Dickey Turnover.,49,68
4:24,2426,Hasan Abdullah Steal.,49,68
4:22,2426,Shawn Anderson made Layup. Assisted by Hasan Abdullah.,51,68
4:03,2430,UNC Greensboro  Timeout,51,68
3:48,2430,R.J. White Turnover.,51,68
3:47,2426,Hasan Abdullah Steal.,51,68
3:34,2430,Foul on Francis Alonso.,51,68
3:34,2426,Shawn Anderson made Free Throw.,53,68
3:34,2426,Shawn Anderson made Free Throw.,52,68
3:04,2430,Demetrius Troy made Jumper.,53,70
2:46,2426,Shawn Anderson Turnover.,53,70
2:44,2430,Marvin Smith Steal.,53,70
2:44,2426,Foul on George Kiernan.,53,70
2:16,2430,Demetrius Troy Turnover.,53,70
2:14,2426,Hasan Abdullah Steal.,53,70
2:08,2426,Bryce Dulin missed Three Point Jumper.,53,70
2:08,2426,Hasan Abdullah Offensive Rebound.,53,70
2:04,2426,Mo Lewis made Layup. Assisted by Hasan Abdullah.,55,70
1:30,2430,Marvin Smith Turnover.,55,70
1:17,2426,James Butler made Jumper. Assisted by Kyran McClure.,57,70
0:51,2430,Diante Baldwin Turnover.,57,70
0:49,2426,Hasan Abdullah Steal.,57,70
0:44,2426,Hasan Abdullah Turnover.,57,70
0:44,2430,Diante Baldwin Steal.,57,70
0:40,2430,Malik Massey made Layup.,57,72
0:20,2426,Mo Lewis missed Jumper.,57,72
0:20,2426,Grant Vermeer Offensive Rebound.,57,72
0:17,2426,Grant Vermeer made Two Point Tip Shot.,59,72
0:00,2430,End of Game,59,72
